{
  "checked_at": "2026-04-15T12:00:00.123456Z",
  "timezone": "Asia/Seoul",
  "attribution": "RESERVATION_CREATED_AT",
  "quota_timezone": "UTC",
  "day": {
    "local_key": "2026-04-15",
    "start_at": "2026-04-14T15:00:00Z",
    "end_at": "2026-04-15T15:00:00Z",
    "request_count": 8,
    "counts": {
      "measured": 2,
      "pending": 1,
      "in_progress": 1,
      "unstarted": 1,
      "uncertain": 2,
      "legacy_unavailable": 1
    },
    "measured": {
      "request_count": 2,
      "input_tokens": 50,
      "output_tokens": 15,
      "compute_ms": 225,
      "peak_memory_bytes": 8192,
      "external_cost_usd_micro": null
    },
    "conservative_reserved": {
      "request_count": 7,
      "max_compute_ms": 420000,
      "max_output_tokens": 3584
    }
  },
  "month": {
    "local_key": "2026-04",
    "start_at": "2026-03-31T15:00:00Z",
    "end_at": "2026-04-30T15:00:00Z",
    "request_count": 8,
    "counts": {
      "measured": 2,
      "pending": 1,
      "in_progress": 1,
      "unstarted": 1,
      "uncertain": 2,
      "legacy_unavailable": 1
    },
    "measured": {
      "request_count": 2,
      "input_tokens": 50,
      "output_tokens": 15,
      "compute_ms": 225,
      "peak_memory_bytes": 8192,
      "external_cost_usd_micro": null
    },
    "conservative_reserved": {
      "request_count": 7,
      "max_compute_ms": 420000,
      "max_output_tokens": 3584
    }
  }
}
